name,address,phone_numbers,websites
Legal Services of Northern Michigan (Marquette Office),"112 W. Washington St., Suite 1, Marquette, MI 49855",(906) 228-5620,http://www.lsnm.org 
Legal Services of Northern Michigan (Sault Ste. Marie Office),"130 W. Spruce St., Sault Sainte Marie, MI 49783",(906) 632-3361,http://www.lsnm.org 
Legal Services of Northern Michigan (Traverse City Office),"221 Garland St, Suite H, Traverse City, MI 49684",(231) 941-0771,http://www.lsnm.org 
Legal Services of South Central Michigan (Battle Creek Office),"123 W. Territorial, Battle Creek, MI 49015",(269) 965-3951,http://www.lsscm.org 
Legal Services of South Central Michigan (Jackson Office),"540 N. Jackson St, Jackson, MI 49201",(517) 787-6111,http://www.lsscm.org 
Legal Services of South Central Michigan (Lansing Office),"3490 Belle Chase Way, Suite 50, Lansing, MI 48911",(517) 394-3121,http://www.lsscm.org 
Legal Services of South Central Michigan (Monroe Office),"1118 S. Telegraph Rd, Suite A, Monroe, MI 48161",(734) 241-8310,http://www.lsscm.org 
Legal Services of South Central Michigan (Washtenaw County Office),"420 N. 4th Ave, Ann Arbor, MI 48104",(734) 665-6181,http://www.lsscm.org 
Legal Services of South Central Michigan - Family Law Project,"625 S. State St, Ann Arbor, MI 48107",(734) 998-9454,http://www.lsscm.org 
Michigan Immigrant Rights Center (Ann Arbor Office),"220 E. Huron Street, Suite 600A, Ann Arbor, MI 48104",(734) 239-6863,http://michiganimmigrant.org 	mirc@michiganimmigrant.org
Michigan Immigrant Rights Center (Kalamazoo Office),"3030 S. 9th St., Ste 1B, Kalamazoo, MI 49009",(734) 239-6863,http://www.michiganimmigrant.org 	mirc@michiganimmigrant.org
"Michigan Migrant Legal Assistance Project, Inc.","1104 Fuller Ave N.E., Grand Rapids, MI 49503",(616) 454-5055,http://www.mmlap.com 	info@mmlap.com
Michigan State University College of Law Immigration Law Clinic,"610 Abbot Rd, East Lansing, MI 48823",(517) 336-8088,http://www.law.msu.edu/clinics/immigration/about.html 	veronica.thronson@law.msu.edu
Michigan United - (West Kalamazoo Office),"1009 E. Stockbridge Avenue, Ste. 300, Kalamazoo, MI 49001-3811",(877) 507-7774 ext.705,http://www.miunited.org 	brannigan@miunited.org
Michigan United - East (Detroit Office),"4405 Wesson Street, Detroit, MI 48210",(248) 509-4430,http://www.miunited.org 	diego@miunited.org
Piast Institute,"11633 Joseph Campau St, Hamtramck, MI 48212",(313) 733-4535,http://www.piastinstitute.org 	info@piastinstitute.org
Samaritas,"2170 E. Big Beaver Rd., Suite C, Troy, MI 48083",(248) 663-8135,https://samaritas.org 	aalje@samaritas.org
St. Vincent Catholic Charities - Immigration Law Clinic,"2800 W. Willow St., Lansing, MI 48917",(517) 323-4734 ext. 1800,http://www.stvcc.org 
Telamon Corporation - Michigan Immigration Counseling Services,"416 N. Cedar St., Lansing, MI 48912",(517) 323-7002 ext. 124,http://www.telamon.org/michigan-immigration.aspx 	miimmigration@telamon.org
University of Michigan Law School Clinical Law Program,"801 Monroe St, Ann Arbor, MI 48109",(734) 763-4319,http://www.law.umich.edu/Pages/default.aspx 	mclp@umich.edu
Arrive Ministries,"1515 E. 66th St, Richfield, MN 55423",(612) 243-2961,http://www.arriveministries.org 	immigration@arriveministries.org
Battered Women's Legal Advocacy Project,"1611 Park Ave S., Suite 2, Minneapolis, MN 55404",(612) 343-9842,http://www.bwlap.org 	info@bwlap.org
Civil Society,"332 Minnesota St, Suite E-1436, St. Paul, MN 55101",(651) 291-0713,http://civilsocietyhelps.org 	office@civilsocietyhelps.org
Community Action Partnership of Suburban Hennepin,"8800 Highway 7, Suite 401, St. Louis Park, MN 55426",(952) 697-1365,http://www.capsh.org 	cwatson@capsh.org
Immigrant Law Center of Minnesota (St. Paul Office),"450 N. Syndicate St., Suite 200, St. Paul, MN 55104",(651) 641-1011,http://www.ilcm.org 
Immigrant Law Center of Minnesota (Worthington Office),"PO Box 993, Worthington, MN 56187",(651) 641-1011,http://www.ilcm.org 
International Institute of Minnesota,"1694 Como Ave, St. Paul, MN 55104",(651) 647-0191,http://www.iimn.org 	info@iimn.org
Lutheran Social Service of Minnesota - Refugee Services,"2400 Park Ave, Minneapolis, MN 55408",(612) 879-5263,http://www.lssmn.org 
Mid-Minnesota Legal Aid (St. Cloud Office),"830 W. St. Germain St, Suite 300, PO Box 886, St. Cloud, MN 56302",(320) 253-0121,http://www.mylegalaid.org/poverty-law/st-cloud-area-legal-services 
Mid-Minnesota Legal Aid (Willmar Office),"PO Box 1866, 415 7th St S.W., Willmar, MN 56201",(320) 235-9600,http://www.mylegalaid.org 
Mid-Minnesota Legal Aid - Immigration Law Project,"430 1st Ave N., Suite 300, Minneapolis, MN 55401",(612) 332-1441,http://www.mylegalaid.org 	MPLSimmigrationintake@mylegalaid.org
Minnesota Council of Churches - Refugee Services,"122 Franklin Ave W., Suite 100, Minneapolis, MN 55404",(612) 874-8605,http://www.mnchurches.org 	mcc@mnchurches.org
New American Alliance for Development (NAAD),"1821 University Ave W., Suite 328-South, St. Paul, MN 55104",(651) 645-5828,http://newamericansalliance.org 	yendeanderson@yahoo.com
Park Avenue Legal Clinic,"3400 Park Ave S., Park Avenue United Methodist Church, Minneapolis, MN 55404",(612) 825-6864 ext. 564,http://www.vlnmn.org 	colleen.beebe@vlnmn.org
"Southern Minnesota Regional Legal Services - Refugee, Immigrant, and Migrant Services (Rochester Office)","2500 Valleyhigh Dr N.W., Rochester, MN 55901",(507) 289-6199,http://www.smrls.org 	citizenship.rochester@smrls.org
"Southern Minnesota Regional Legal Services - Refugee, Immigrant, and Migrant Services (St. Paul Office)","450 N. Syndicate St, Suite 285, St. Paul, MN 55104",(651) 291-2837,http://www.smrls.org 	rims@smrls.org
The Advocates for Human Rights,"330 2nd Ave S., Suite 800, Minneapolis, MN 55401",(612) 341-9845 ,http://www.theadvocatesforhumanrights.org 	hrights@advrights.org
United Cambodian Association of Minnesota,"1385 Mendota Heights Rd, Suite 500, Mendota Heights, MN 55120",(651) 222-3299,http://www.ucamin.org 
University of Minnesota - Detainee Rights Clinic,"190 Mondale Hall, 229 19th Avenue South, Minneapolis, MN 55455",(612) 301-1156,rlchan@umn.edu
Volunteer Lawyers Network,"600 Nicollet Mall, Suite 390A, Minneapolis, MN 55402",(612) 752-6677,http://vlnmn.org 	vln@vlnmn.org
Catholic Charities of Jackson - Immigration Clinic,"200 N. Congress St, Suite 100, Jackson, MS 39201",(601) 948-2635,http://www.catholiccharitiesjackson.org 	immclinic@ccjackson.org
El Pueblo,"856 Division Street, Biloxi, MS 39530",(228) 436-3986,http://www.elpueblo-ms.org 	info@elpueblo-ms.org
Mississippi Immigrants Rights Alliance (Biloxi Office),"610 Water Street, Biloxi, MS 39530",(228) 386-5164,http://www.yourmira.org 
Mississippi Immigrants Rights Alliance (Jackson Office),"612 N. State St., Suite B, 2nd Floor, Jackson, MS 39202",(601) 354-9355 ext. 3,http://www.yourmira.org 
Bi-Lingual International Assistant Services (St. Louis Office),"1329 Macklind Ave, Suite 210, St. Louis, MO 63110",(314) 645-7800,http://bilingualstl.org 	admin@Bilingualstl.org
"Catholic Charities of Central and Northern Missouri, Diocese of Jefferson City - Refugee & Immigration Services","1130 E. Elm St, P.O. Box 2183, Jefferson City, MO 65102",(573) 632-0017,http://www.cccnmo.org 	ltran@cccnmo.org
Catholic Charities of St. Louis - Catholic Immigration Law Project,"100 N. Tucker Blvd., Suite 726, St. Louis, MO 63101",(314) 977-7282,https://sfcsstl.org/locations/clam/ 
Immigration Professionals,"214 W. 18th St., Suite 100, Kansas City, MO 64108",(816) 221-2277,http://www.immigrationprofessionals.us 	info@immigrationprofessionals.us
International Institute of St. Louis,"3401 Arsenal Street, St. Louis, MO 63118",(314) 773-9090,http://www.iistl.org 	maasl@iistl.org
InterServ - Immigrant Services Program,"1412 N. 3rd Street, St. Joseph, MO 64505",(816) 232-7779 ext. 228,http://www.inter-serv.org/immigrant_services.htm 	dsalcido@inter-serv.org
Jewish Vocational Service,"1608 Baltimore, Kansas City, MO 64108",(816) 471-2808,http://www.jvskc.org 	info@jvskc.org
Legal Aid of Western Missouri (Kansas City West Office),"920 Southwest Blvd, Kansas City, MO 64108",(816) 474-9868,http://www.lawmo.org 
Legal Services of Eastern Missouri - Immigration Law Project (St. Louis Office),"4232 Forest Park Ave., St. Louis, MO 63108",,314 256 8741	http://www.lsem.org 	kmreid@lsem.org
Migrant and Immigrant Community Action Project,"1600 S. Kingshighway, Ste. 2N, St. Louis, MO 63110",(314) 995-6995,http://www.mica-project.org 	info@mica-project.org
The Clinic,"515 Avenida Cesar E. Chavez, Kansas City, MO 64108",(816) 994-2300,http://theclinickc.org 
HAVEN,"PO Box 752, Bozeman, MT 59771",(406) 586-7689,http://www.havenmt.org 	programdirector@havenmt.org
Catholic Charities of Omaha - Immigration Legal Assistance Services,"5211 S. 31st Street, Omaha, NE 68107",(402) 939-4615,http://www.ccomaha.org/what-we-do/immigration-legal-assistance.html 	JessicaB@ccomaha.org 
Catholic Social Services of Southern Nebraska (Lincoln Office),"2241 O St., Lincoln, NE 68510",(402) 474-1600,http://www.cssisus.org 
Centro Hispano Comunitario de Nebraska,"3020 18th Street, Suite 7, Columbus, NE 68601",(402) 564-2110,http://www.centrohispanos.com 	karen@centrohispanos.com
Justice For Our Neighbors Nebraska,"2414 E St, Omaha, NE 68107",(402) 898-1349,http://www.jfon-ne.org 	info@jfon-ne.org
Lutheran Family Services - Lutheran Immigration Services (Grand Island Office),"1811 W. 2nd Street, Suite 440, Grand Island, NE 68803",(308) 382-4255,http://www.lfsneb.org/community/immigration.asp 	cthomas@lfsneb.org
Lutheran Family Services - The Welcome Center,"200 West 7th Street, PO Box 945, Lexington, NE 68850",(308) 324-2312 ext. 31,http://www.lfsneb.org 	ebowman@lfsneb.org
Lutheran Family Services of Nebraska (Omaha Office),"1941 South 42nd Street, Ste. 402, The Center Mall, Omaha, NE 68105",(402) 536-3529,http://www.lfsneb.org/community/immigration.asp 	ebowman@lfsneb.org
Nebraska Coalition to End Sexual and Domestic Violence,"245 S. 84th St, Suite 200, Lincoln, NE 68510",(402) 476-6256,http://www.nebraskacoalition.org 
Saint Mary's Immigration Program,"207 S Elm St, Grand Island, NE 68801",(308) 381-2855,http://www.smiplegal.com 	carmen.corona@smiplegal.com
University of Nebraska College of Law - Immigration Clinic,"172 Welpton Courtroom, Lincoln, NE 68583",(402) 472-3271,http://law.unl.edu 	kruser1@unl.edu
"Catholic Charities of Northern Nevada, St. Vincents Center - Immigration Assistance Program","500 E. 4th St, Reno, NV 89512",(775) 322-7073 ext. 730,http://ccnnimmigration.wordpress.com 	immigration@ccsnn.org
Hermandad Mexicana,"Rafael Rivera Community Center, 2900 E. Stewart Ave, Las Vegas, NV 89101",(702) 598-0052,http://www.hermandadlasvegas.org 	info@Hermandad-Mexicana.org
Legal Aid Center of Southern Nevada,"725 E. Charleston Blvd, Las Vegas, NV 89104",(702) 386-1070,http://www.lacsn.org 
Nevada Legal Services (Las Vegas Office),"530 S. 6th St, Las Vegas, NV 89101",(702) 386-0404,http://www.nlslaw.net 
Nevada Legal Services (Reno Office),"204 Marsh St., Suite 101, Reno, NV 89509",(775) 284-3491,http://www.nlslaw.net 
Volunteer Attorneys for Rural Nevadans,"904 N. Nevada St., P.O. Box 365, Carson City, NV 89703",(775) 883-8278,http://www.varn.org 	info@varn.org
Washoe Legal Services,"299 S. Arlington Ave., Reno, NV 89501",(775) 329-2727,http://www.washoelegalservices.org 
Catholic Charities New Hampshire - Immigration and Refugee Legal Services (Manchester Office),"325 Franklin St, Manchester, NH 03101",(603) 624-4717,http://www.nh-cc.org 	manchester@nh-cc.org
Catholic Charities New Hampshire - Immigration and Refugee Legal Services (Nashua Office),"261 Lake St, Nashua, NH 03060",(603) 889-9431,http://www.cc-nh.org 	info@cc-nh.org
Welcoming All Nationalities Network of the Upper Valley,"P.O. Box 203, Lyme, NH 03768",(603) 795-2155,https://www.facebook.com/WANN.uppervalley 	development@uppervalleywann.org
"African Hispanic Immigration Organization, Inc. (Newark Office)","5 Central Avenue, Newark, NJ 07102",(973) 370-0907,http://ahiolaw.org 	ahiolaw@gmail.com
"African Hispanic Immigration Organization, Inc. (Pennsauken)","4821 Westfield Ave, Pennsauken, NJ 08110",(973) 370-0907,http://ahiolaw.org 	ahiolaw@gmail.com
American Friends Service Committee - Immigrant Rights Program (Newark Office),"89 Market St, 6th Floor, Newark, NJ 07102",(973) 643-1924,http://afsc.org/program/immigrant-rights-program-newark-nj 	irpnewark@afsc.org
Camden Center for Law and Social Justice (Atlantic City Office),"9 N. Georgia Ave, Atlantic City, NJ 08401",(856) 583-2950,http://www.cclsj.org 
Camden Center for Law and Social Justice - Immigration Services (Camden Office),"126 N. Broadway, 2nd Floor, Camden, NJ 08102",(856) 583-2950,http://www.cclsj.org 
Casa Esperanza,"213 West Union Ave, Bound Brook, NJ 08805",(732) 748-1111,http://www.casaesperanzanj.com 	casaesperanzanj@yahoo.com
Catholic Charities of Camden - Immigration Services (Atlantic City Office),"9 N. Georgia Ave, Atlantic City, NJ 08401",(609) 345-7737,http://www.catholiccharitiescamden.org 
Catholic Charities of Camden - Immigration Services (Camden Office),"1845 Haddon Ave, Camden, NJ 08103",(856) 342-4161,http://www.catholiccharitiescamden.org 
Catholic Charities of Metuchen - Immigration Services (New Brunswick Office),"56 Throop Ave, Holy Family Parish Pastoral Center Offices, New Brunswick, NJ 08901",(732) 214-8743,http://www.ccdom.org/immigration/immigration-program 
Catholic Charities of Metuchen - Immigration Services (Perth Amboy Office),"319 Maple St., Perth Amboy, NJ 08861",(732) 324-8200,http://www.ccdom.org 
Catholic Charities of Metuchen - Immigration Services (Phillipsburg Office),"700 Sayre Avenue, Phillipsburg, NJ 08865",(908) 777-3730,http://www.ccdom.org 
Catholic Charities of Paterson - Legal Services Department,"212 Slater Street, Suite 201, Paterson, NJ 07501",(973) 279-7100,http://www.catholicharities.org/index.php?option=com_content&view=frontpage&Itemid=1 
Catholic Charities of the Archdiocese of Newark - Bishop Francis Center for Immigration Legal Services,"976 Broad St, Newark, NJ 07102",(973) 733-3516,http://www.ccannj.com 	Catholic-Charities@ccannj.org
Catholic Charities Trenton - Immigration Legal Assistance (Lakewood Office),"200 Monmouth Ave, Lakewood, NJ 08701",(732) 363-5322,http://www.catholiccharitiestrenton.org 	info@cctrenton.org
Church World Service (Jersey City Office),"26 Journal Square, Suite 600, Jersey City, NJ 07306",(201) 659-0467,http://www.cwsglobal.org 	immigration@cwsglobal.org
El Centro de Recursos para Familias of Catholic Charities,"327 S. Broad St, Trenton, NJ 08608",(609) 394-2056,http://www.catholiccharitiestrenton.org 
El Centro Hispanoamericano,"525 E. Front St, Plainfield, NJ 07060",(908) 753-8730,http://www.elcentronj.org 	elcentronj@gmail.com
El Comite de Apoyo a los Trabajadores Agrícolas (Glassboro Office),"4 South Delsea Drive, Glassboro, NJ 08028",(856) 881-2507,http://www.cata-farmworkers.org 	catanj@aol.com
Immigration and American Citizenship Organization,"647 Main Ave, Suite 205, Passaic, NJ 07055",(973) 472-4648,http://www.iacoimmigration.org 	etorres@iacoimmigration.org
Jewish Family Services of Middlesex County (Milltown Office),"32 Ford Ave., 2nd Floor, Milltown, NJ 08850",(732) 777-1940,http://www.jfvs.org 	debbya@jfsmiddlesex.org
Kids in Need of Defense (Newark Office),"65 Livingston Ave, Roseland, NJ 07068",(862) 926-2080,http://www.supportkind.org 	splastino@supportkind.org
La Casa De Don Pedro - Center II,"39 Broadway, Newark, NJ 07104",(973) 481-4568,http://www.lacasanwk.org 
"Latin American Legal Defense and Education Fund, Inc.","669 Chambers St, Suite B, Trenton, NJ 08611",(609) 688-0881,http://www.laldef.org 	info@laldef.org
Legal Services of New Jersey - Immigration Representation Project,"P.O. Box 1357, Edison, NJ 08818",(888) 576-5529,http://www.lsnj.org 	legalhelp@lsnj.org
Lutheran Social Ministries of New Jersey - Immigration and Refugee Services,"189 S. Broad St, PO Box 30, Trenton, NJ 08608",(609) 393-4900,http://www.lsmnj.org 
Rutgers-Newark Immigrant Rights Clinic,"123 Washington St, Newark, NJ 07102",(973) 353-5292,ag912@law.rutgers.edu
Casa Reina Sisters of Our Lady of Guadalupe and St. Joseph (Gallup Office),"711 S Puerco Dr, Gallup, NM 87301",(505) 722-5511,casareina@qwestoffice.net
"Catholic Charities Legal Services Program - Las Cruces, NM","2215 S. Main St., Suite B, Las Cruces, NM 88005",(575) 527-0500,http://www.catholiccharitiesdlc.org/about/legal-services-program 	lsp@catholiccharitiesdlc.org
Catholic Charities of Albuquerque - Center for Immigration & Citizenship Legal Assistance (Albuquerque Office),"2010 Bridge Blvd S.W., Albuquerque, NM 87105",(505) 247-0442,https://www.ccasfnm.org 
Catholic Charities of Albuquerque - Center for Immigration & Citizenship Legal Assistance (Santa Fe Office),"1234 San Felipe Avenue, Santa Fe, NM 87505",(505) 424-9789,https://www.ccsafnm.org 	immi.sf@ccasfnm.org
New Mexico Immigrant Law Center,"714 4th St S.W., Albuquerque, NM 87102",(505) 247-1023,http://nmilc.org 
Santa Fe Dreamers Project,"PO Box 8009, Santa Fe, NM 87504",(505) 490-2789,http://www.santafedreamersproject.org 	info@santafedreamersproject.org
University of New Mexico School of Law - Community Lawyering Clinic,"1117 Stanford N.E., MSC11-6070, 1 University of New Mexico, Albuquerque, NM 87131",(505) 277-5265,http://lawschool.unm.edu/index.php 
"African Hope Committee, Inc.","441 Convent Ave, Suite 4D, New York, NY 10031",(212) 862-9010,http://www.afriquehope.org 	info@afriquehope.org
African Services Committee,"429 West 127th Street, New York, NY 10027",(212) 222-3882,http://www.africanservices.org 	immigration@africanservices.org
AIDS Center of Queens County,"161-21 Jamaica Avenue, 6th Floor, Jamaica, NY 11432",(718) 896-2500,http://acqc.org 
American Civic Association,"131 Front St, Binghamton, NY 13905",(607) 723-9419,http://www.americancivic.com 	americancivic@stny.rr.com
Ansob Center for Refugees,"28-19 Steinway St, 2nd Floor, Astoria, NY 11103",(718) 278-4303,imanansob@yahoo.com
Arab-American Family Support Center,"150 Court St, 3rd Floor, Brooklyn, NY 11201",(718) 643-8000,http://www.aafscny.org 	info@aafscny.org
Asian American Legal Defense and Education Fund,"99 Hudson St, 12th Floor, New York, NY 10013",(212) 966-5932,http://aaldef.org 	info@aaldef.org
Atlas: DIY,"462 36th Street, Suite PH-B, Brooklyn, NY 11232",(347) 599-1641,http://www.Atlasdiy.org 	becky.mcbride@atlasdiy.org
Benjamin N. Cardozo School of Law - Immigration Justice Clinic,"55 5th Ave, 11th Floor, New York, NY 10003",(212) 790-0340,http://www.cardozo.yu.edu 	pmarkowi@yu.edu
"Bronx Works, Inc. (Grand Concourse Office)","2070 Grand Concourse, Suite 1, Bronx, NY 10457",(718) 731-3114,http://www.bronxworks.org 
Brooklyn Defender Services - Immigration Practice,"177 Livingston St, 5th Floor, Brooklyn, NY 11201",(718) 254-0700,http://www.bds.org 
Brooklyn Legal Services (Court St.),"105 Court St, 4th Floor, Brooklyn, NY 11201",(718) 237-5500,http://www.legalservicesnyc.org/our-program/brooklyn 
Brooklyn Legal Services (Fulton St.),"1360 Fulton St, Suite 301, Brooklyn, NY 11216",(718) 636-1155,http://www.legalservicesnyc.org/our-program/brooklyn 
Cabrini Immigrant Services of New York City,"139 Henry St, New York, NY 10002",(212) 791-4590 x100,http://www.cis-nyc.org 	info@cis-nyc.org
Camba Legal Services,"2211 Church Ave, Brooklyn, NY 11226",(718) 940-6311,http://www.camba.org 	info@camba.org
Caribbean Women's Health Association - Immigrant Service Center,"3512 Church Ave, Brooklyn, NY 11203",(718) 826-2942,http://www.cwha.org 	aaly@cwha.org
Catholic Charities Community Services - Legal Services for Immigrants (Brewster Office),"175 Main Street, Brewster, NY 10509",(845) 942-5791,http://www.catholiccharitiesny.org 
Catholic Charities Community Services - Legal Services for Immigrants (Kingston Office),"6 Adams St, Suite 3, Kingston, NY 12401",(845) 340-9170 x100 or (212) 419-3700,http://www.catholiccharitiesny.org 
Catholic Charities Community Services - Legal Services for Immigrants (Middletown Office),"305 North St, Middletown, NY 10940",(845) 343-7675,http://catholiccharitiesny.org 
Catholic Charities Community Services - Legal Services for Immigrants (New York Office),"80 Maiden Lane, 13th Floor, New York, NY 10038",(212) 419-3700,http://www.catholiccharitiesny.org 
Catholic Charities Community Services - Legal Services for Immigrants (Newburgh Office),"The Newburgh Armory Unity Center, 321 South William Street, Newburgh, NY 12550",,1-845-562-4736	http://www.catholiccharitiesny.org 
Catholic Charities Community Services - Legal Services for Immigrants (Poughkeepsie Office),"218 Curch Street, Poughkeepsie, NY 12601",,1-845-452-1400	ext. 4259	http://www.catholiccharitiesny.org 
Catholic Charities Community Services - Legal Services for Immigrants (Rockland County),"78 Hudson Ave, Haverstraw, NY 10927",(845) 942-5791 or (212) 419-3700,http://www.catholiccharitiesny.org 
Catholic Charities Community Services - Legal Services for Immigrants (Staten Island Office),"1546 Castleton Ave, Staten Island, NY 10302",(718) 420-6466 or (212) 419-3700,http://www.catholiccharitiesny.org 
Catholic Charities Community Services - Legal Services for Immigrants (Yonkers Office),"204 Hawthorne Avenue, Yonkers, NY 10705",(914) 476-2700,http://www.catholiccharitiesny.org 
Catholic Charities of Albany - Immigration Services,"40 N. Main Ave, Albany, NY 12203",(518) 453-6650,http://www.ccrcda.org 	catholic.charities@rcda.org
Catholic Charities of Buffalo - Immigration and Refugee Assistance,"20 Herkimer St, Buffalo, NY 14213",(716) 842-0270,http://www.ccwny.org 
Catholic Charities of Onondaga County,"527 N. Salina St, Syracuse, NY 13208",(315) 474-7428 x11,http://www.ccoc.us 	fcastricone@ccoc.us
Catholic Charities Tompkins/Tioga,"324 W. Buffalo St, Ithaca, NY 14850",(607) 272-5062,http://www.catholiccharitiestt.org 	schaffee@dor.org
Catholic Family Center,"87 N. Clinton Ave, Rochester, NY 14604",(585) 546-7220,http://www.cfcrochester.org 
"Catholic Migration Services, Inc. (Brooklyn Office)","191 Joralemon St., 4th Fl, Brooklyn, NY 11201",(718) 236-3000,http://www.catholicmigration.org 
"Catholic Migration Services, Inc. (Queens Office)","47-01 Queens Blvd, Suite 201, Sunnyside, NY 11104",(347) 472-3500,http://www.catholicmigration.org 
Central American Legal Assistance,"240 Hooper St., Brooklyn, NY 11211",(718) 486-6800,http://centralamericanlegal.info 	cala@igc.org
Central American Refugee Center (Brentwood Office),"2000 Brentwood Road, 2nd Floor, Brentwood, NY 11717",(631) 273-8721,http://www.carecenny.org 
Central American Refugee Center (Hempstead Office),"91 N. Franklin St., Suite 208, Hempstead, NY 11550",(516) 489-8330,http://www.carecenny.org 
Church World Service (New York Office),"475 Riverside Dr, Suite 700, New York, NY 10115",(212) 870-2814,http://www.cwsglobal.org 
City Bar Justice Center,"42 W. 44th St, New York, NY 10036",(212) 382-6710,http://www2.nycbar.org/citybarjusticecenter 	immigrantjustice@nycbar.org
Connect,"127 W. 127th St, New York, NY 10027",(212) 683-0605,http://www.connectnyc.org 	connect@connectnyc.org
Cornell Law School Clinical Programs,"Myron Taylor Hall, Ithaca, NY 14853",(607) 254-5186,http://www.lawschool.cornell.edu/clinical-programs 	sjt29@cornell.edu
CUNY Citizenship Now! - City College Immigration Center,"160 Convent Ave., North Academic Center, Room 1-206, New York, NY 10031",(212) 650-6620,http://www.cuny.edu/citizenshipnow 
CUNY Citizenship Now! - City Council Member Andy King's Office,"938 E. Gun Hill Rd., Bronx, NY 10467",(718) 684-5509,http://www.cuny.edu/citizenshipnow 
CUNY Citizenship Now! - City Council Member Annabel Palma's Office,"1041 Castle Hill Ave., Bronx, NY 10472",(718) 792-1140 ,http://www.cuny.edu/citizenshipnow 
CUNY Citizenship Now! - City Council Member Barry Grodenchik's Office,"197-15 Hillside Avenue, Hollis, NY 11423",(718) 264-7895,http://www.cuny.edu/citizenshipnow 
CUNY Citizenship Now! - City Council Member Carlos Menchaca's Office,"4417 4th Avenue, Brooklyn, NY 11220",(718) 439-9012 ext. 100,http://www.cuny.edu/citizenshipnow 
CUNY Citizenship Now! - City Council Member Daniel Dromm's Office,"108-25 62nd Drive, Forest Hills, NY 11375",(718) 898-7461 ,http://www.cuny.edu/citizenshipnow 
CUNY Citizenship Now! - City Council Member Darlene Mealy's Office,"1757 Union St., 2nd Floor, Brooklyn, NY 11213",(718) 953-3097 ,http://www.cuny.edu/citizenshipnow 
CUNY Citizenship Now! - City Council Member David Greenfield's Office,"4424 16th Ave., Brooklyn, NY 11204",(718) 853-2704,http://www.cuny.edu/citizenshipnow 
CUNY Citizenship Now! - City Council Member Deborah Rose's Office,"130 Stuyvesant Place, 6th Floor, Room 602, Staten Island, NY 10301",(718) 556-7370,http://www.cuny.edu/citizenshipnow 
CUNY Citizenship Now! - City Council Member Elizabeth S. Crowley's Office,"Atlas Park Mall, 71-19 80th Street, Suite 8-303, Glendale, NY 11385",(718) 366-3900,http://www.cuny.edu/citizenshipnow 
CUNY Citizenship Now! - City Council Member Eric Ulrich's Office,"93-06 101st Ave., Ozone Park, NY 11416",(718) 738-1083,http://www.cuny.edu/citizenshipnow 
CUNY Citizenship Now! - City Council Member Fernando Cabrera's Office,"107 E. Burnside Ave., Bronx, NY 10453",(347) 590-2874,http://www.cuny.edu/citizenshipnow 
CUNY Citizenship Now! - City Council Member James Vacca's Office,"3040 E. Tremont Ave., Room 104, Bronx, NY 10461",(718) 931-1721 ,http://www.cuny.edu/citizenshipnow 
CUNY Citizenship Now! - City Council Member Julissa Ferreras' Office,"32-33A Junction Blvd., East Elmhurst, NY 11369",(718) 651-1917 ,http://www.cuny.edu/citizenshipnow 
CUNY Citizenship Now! - City Council Member Jumaane Williams' Office,"4517 Avenue D, Brooklyn, NY 11203",(718) 629-2900,http://www.cuny.edu/citizenshipnow 
CUNY Citizenship Now! - City Council Member Karen Koslowitz's Office,"108-25 62nd Drive, Forest Hills, NY 11375",(347) 965-1213,http://www.cuny.edu/citizenshipnow 
